<?xml version="1.0" encoding="UTF-8"?>
<xs:schema xmlns:xs="http://www.w3.org/2001/XMLSchema">


	<xs:element name="Events">
		<xs:complexType>
			<xs:sequence>
				<xs:element name="event" maxOccurs="unbounded">
					<xs:complexType>
						<xs:sequence>
							<xs:element name="Event-ID" type="xs:positiveInteger" />
							<xs:element name="Spielzeitraum">
								<xs:complexType>
									<xs:sequence>
										<xs:element name="von" type="xs:dateTime" />
										<xs:element name="bis" type="xs:dateTime" />
									</xs:sequence>
								</xs:complexType>
							</xs:element>
							<xs:element name="Sportart">
								<xs:simpleType>
									<xs:restriction base="xs:string">
										<xs:enumeration value="FuÃŸball" />
										<xs:enumeration value="Basketball" />
										<xs:enumeration value="Tennis" />
									</xs:restriction>
								</xs:simpleType>
							</xs:element>
							<xs:element name="Oertlichkeit">
								<xs:complexType>
									<xs:sequence>
										<xs:element name="Ort-ID" type="xs:positiveInteger" />
										<xs:element name="Ort" type="xs:string" />
										<xs:element name="Platz" type="xs:string" />
										<xs:element name="min.Spieleranzahl" type="xs:positiveInteger" />
										<xs:element name="max.Spieleranzahl" type="xs:positiveInteger" />
										<xs:element name="Oeffnungszeiten">
											<xs:complexType>
												<xs:sequence>
													<xs:element name="geoeffnet_von" type="xs:time" />
													<xs:element name="geoeffnet_bis" type="xs:time" />
													<xs:element name="geschlossen_an" type="xs:string" />
												</xs:sequence>
											</xs:complexType>
										</xs:element>
										<xs:element name="Preis">
											<xs:simpleType>
												<xs:restriction base="xs:decimal">
													<xs:minInclusive value="0" />
												</xs:restriction>
											</xs:simpleType>
										</xs:element>
									</xs:sequence>
								</xs:complexType>
							</xs:element>
							<xs:element name="Spielerliste">
								<xs:complexType>
									<xs:sequence>
										<xs:element name="Spieler" maxOccurs="unbounded">
											<xs:complexType>
												<xs:sequence>
													<xs:element name="Anzeigename" type="xs:string" />
													<xs:element name="Telefonnummer" type="xs:string" />
												</xs:sequence>
												<xs:attribute name="subAdmin" type="xs:boolean" />
											</xs:complexType>
										</xs:element>
									</xs:sequence>
									<xs:attribute name="min.Spieler" type="xs:positiveInteger" />
									<xs:attribute name="max.Spieler" type="xs:positiveInteger" />
								</xs:complexType>
							</xs:element>
							<xs:element name="Backlist">
								<xs:complexType>
									<xs:sequence>
										<xs:element name="Spieler" maxOccurs="unbounded">
											<xs:complexType>
												<xs:sequence>
													<xs:element name="Anzeigename" type="xs:string" />
													<xs:element name="Telefonnummer" type="xs:string" />
												</xs:sequence>
												<xs:attribute name="subAdmin" type="xs:boolean" />
											</xs:complexType>
										</xs:element>
									</xs:sequence>
								</xs:complexType>
							</xs:element>
							<xs:element name="Admin">
								<xs:complexType>
									<xs:sequence>
										<xs:element name="Anzeigename" type="xs:string" />
										<xs:element name="Telefonnummer" type="xs:string" />
									</xs:sequence>
									<xs:attribute name="subAdmin" type="xs:boolean" />
								</xs:complexType>
							</xs:element>
						</xs:sequence>
					</xs:complexType>
				</xs:element>
			</xs:sequence>
		</xs:complexType>
	</xs:element>



</xs:schema>