<?xml version="1.0" encoding="UTF-8"?>
<Events xmlns:xsi="http://www.w3.org/2001/XMLSchema-instance"
	xsi:noNamespaceSchemaLocation="event.xsd">
	<event>
		<Event-ID>1</Event-ID>
		<Spielzeitraum>
			<von>2013-07-31T12:00:00</von>
			<bis>2013-07-31T14:00:00</bis>
		</Spielzeitraum>
		<Sportart>Fußball</Sportart>
		<Oertlichkeit>
			<Ort-ID>2</Ort-ID>
			<Ort>Gummersbach</Ort>
			<Platz>Eugen-Haas Sporthalle</Platz>
			<min.Spieleranzahl>10</min.Spieleranzahl>
			<max.Spieleranzahl>40</max.Spieleranzahl>
			<Oeffnungszeiten>
				<geoeffnet_von>10:00:00</geoeffnet_von>
				<geoeffnet_bis>20:30:00</geoeffnet_bis>
				<geschlossen_an>Sonntag</geschlossen_an>
			</Oeffnungszeiten>
			<Preis>5</Preis>
		</Oertlichkeit>
		<Spielerliste>
			<Spieler subAdmin=true>
				<Anzeigename>Hans</Anzeigename>
				<Telefonnummer>012345</Telefonnummer>
			</Spieler>

			<Spieler>
				<Anzeigename>Klaus</Anzeigename>
				<Telefonnummer>0123456</Telefonnummer>
			</Spieler>
		</Spielerliste>
		<Backlist>
			<Spieler>
				<Anzeigename>Michael</Anzeigename>
				<Telefonnummer>8910</Telefonnummer>
			</Spieler>

			<Spieler>
				<Anzeigename>Frank</Anzeigename>
				<Telefonnummer>125</Telefonnummer>
			</Spieler>
		</Backlist>
		<Admin>
			<Anzeigename>Ben</Anzeigename>
			<Telefonnummer>012334</Telefonnummer>
		</Admin>
	</event>

	<event>
		<Event-ID>2</Event-ID>
		<Spielzeitraum>
			<von>2013-07-29T12:00:00</von>
			<bis>2013-07-29T14:00:00</bis>
		</Spielzeitraum>
		<Sportart>Fußball</Sportart>
		<Oertlichkeit>
			<Ort-ID>3</Ort-ID>
			<Ort>Köln</Ort>
			<Platz>Rheinenergie-Stadion</Platz>
			<min.Spieleranzahl>5</min.Spieleranzahl>
			<max.Spieleranzahl>22</max.Spieleranzahl>
			<Oeffnungszeiten>
				<geoeffnet_von>12:00:00</geoeffnet_von>
				<geoeffnet_bis>22:00:00</geoeffnet_bis>
				<geschlossen_an>Sonntag</geschlossen_an>
			</Oeffnungszeiten>
			<Preis>100000</Preis>
		</Oertlichkeit>
		<Spielerliste>
			<Spieler subAdmin=true>
				<Anzeigename>Hans</Anzeigename>
				<Telefonnummer>012345</Telefonnummer>
			</Spieler>

			<Spieler>
				<Anzeigename>Klaus</Anzeigename>
				<Telefonnummer>0123456</Telefonnummer>
			</Spieler>
		</Spielerliste>
		<Backlist>
			<Spieler>
				<Anzeigename>Michael</Anzeigename>
				<Telefonnummer>8910</Telefonnummer>
			</Spieler>

			<Spieler>
				<Anzeigename>Frank</Anzeigename>
				<Telefonnummer>125</Telefonnummer>
			</Spieler>
		</Backlist>
		<Admin>
			<Anzeigename>Ben</Anzeigename>
			<Telefonnummer>012334</Telefonnummer>
		</Admin>
	</event>
</Events>
